name,image,class,subclass,tags,description,hp,hp_backed,hp_cooked,effect_cooked,quality_lvl,potential,duration_bonus_cooked,selling_price,selling_mon,dye_color,food_recipe,armor_upgrade,compendium_id,notes,buying_price,shop
Hinox Guts,40px-BotW_Hinox_Guts_Icon.png?version=d1ca9b559bd06a2b636fe9989f93e3ca (https://v5.airtableusercontent.com/v3/u/41/41/1749067200000/TWuy9ymkdmLmNzfpSQHhUg/70VWMG6lFagj5w-2QL1QtbDUyHc-dB9-Pie-PWf-CjKkz8CAxVbqgIDa_PX_tCZNWctnsgahJ6LbvxEkC8iNxVB1aJXRaac3xdbGRf4G_QflYHLcbpm8a3Yy8At5tc4s3cIsH_JHK_hE6ziDig5DEOmNk8x2VAANM9PO-XW66nI/ViecRIZiRQKzJR6f-M1TH0fSSPzgaVt9sOVRGfnsw6c),Material,Monster Part,,"A giant, smelly Hinox organ of unknown function. Upon closer inspection, it appears to be quivering, It can be used to make an elixir, but some say it has other uses, as well.",,,,,3,,3:10,80,40.0,Yellow,,"Fierce Deity Armor,Fierce Deity Boots,Fierce Deity Mask,Flamebreaker Armor,Flamebreaker Boots,Flamebreaker Helm,Soldier's Armor,Soldier's Greaves,Soldier's Helm",,,,
Dinraal's Scale,40px-BotW_Dinraal%27s_Scale_Icon.png?version=7a9befa783ccce80a29651cbe90d673d (https://v5.airtableusercontent.com/v3/u/41/41/1749067200000/A6DOGy6auCVfJzQBLvy08w/1ZXk9MEZj2jXF_YbrZ51N29mLEKHmCFs_5AqP6hYnLuQet4_LyLagnQ3n-J8wpNZhMd9gl9upm7hKY2RYmz3zgaUTK8R4kyeCbyJhWcPE9FrEQoi4yBDnTs3ednR4G6hIaP4wK_Yd2jCyWwbnZ2en7C2704NVrDOQ-IKt5Ojxhz97x_akKrgh28BJ_yeibqw/Fe5EJ0597Yl1842c6XYA--sNPs_yGqkPb3tX27uovL4),Material,Monster Part,,"This precious scale fell from the red spirit Dinraal. It emanates a great heat, You can use it in cooking, but eating it seems like a waste.",,,1.25,Bonus,1,,1:30,150,60.0,,,,,,,
Farosh's Scale,40px-BotW_Farosh%27s_Scale_Icon.png?version=11106796c16c55ca683c2467553ca946 (https://v5.airtableusercontent.com/v3/u/41/41/1749067200000/gCKMeOXteRsW1dLRAF-cnA/iCNM_sdx8g0HeRAEXPFvCv5nMgSrGkizRVZ6U39aqFNBIhVA598hMmGipOFAoQJ937NVn00DXFaHQ_EJJPDNRJLc0yKbS3ofaprZPlvgTs4w-couO5w7K0RS0Ly5BC_tZIpEIbKnGGwXnB7bG5OO70AoMj4_VAdST4up4_P45E2NcR0Xt3PWiQIbyuVgp1J2/8_HpQVReYWEQCKEnD3Y3OOkxvTK-u76yuLq0t3z_bKM),Material,Monster Part,,"This precious scale fell from the golden spirit Farosh. It contains powerful electricity within. You can cook it, but eating it seems like a waste.",,,1.25,Bonus,1,,1:30,150,60.0,Light,,"Cap of the Wild,Trousers of the Wild,Tunic of the Wild",,,,
Naydra's Scale,40px-BotW_Naydra%27s_Scale_Icon.png?version=6debd9de5dc0e7df94ba5f97c7fa49ad (https://v5.airtableusercontent.com/v3/u/41/41/1749067200000/SZN16uNo6hMJP0N7jYbYYQ/ms5TD1SDgk7XJpTVw1ZfJehOew61hSjeGa7puMYs8PifApFkeWedClDUu7JUaZx0xwe_waWlkFEdvHLSj3QT2yM9813ea05TjUmAwy4SS2FDesdDINviaMVnt4_I3XSgeDELqRmh5mlQjbfb0vFMMkxxm5HUJ0qkXfm32Bp7z7Z3vlhdPyt0Ywk1EbF3uk_B/j4nQsoBYSjGyVmzmkLJ1GYsBre3nYcJjwAV9HsdwPJo),Material,Monster Part,,"This precious scale fell from the blue spirit Naydra. It contains a bitter cold within. You can use it in cooking, but just eating it seems like a waste.",,,1.25,Bonus,1,,1:30,150,60.0,,,"Fierce Deity Armor,Fierce Deity Boots,Fierce Deity Mask,Snow Boots",,,,
Ancient Core,40px-BotW_Ancient_Core_Icon.png?version=252a58c18207fa42bad6ea94c141fd10 (https://v5.airtableusercontent.com/v3/u/41/41/1749067200000/UqeDsjQIkjSEGELZaFwRoA/GPWb8420bD2A2qOp4AzNQDH0RG_Xwco8ipuvduW7a9K1GFUGNJ8eVdO9VevPKRIw_YJTLrGAEza7oe2q3z4M_05sqLRbK2JA27Uwd_BXTQ3j-gVyjmKYdS_l3PUjFmxaC5E5cudORSwfl5tGQPLCdqLjOnNqZaMm7yopd2CMU6S91lRAEg4b3IZjTqKQc9OX/86IWQr-mF2V65lGS4arAgdUL_R835MbhLQkLUgPzTQI),Material,Monster Part,,This crystal was made using lost technology. At one time it was the power source for ancient machines. This item is very valuable to researchers.,,,,,3,,3:10,80,40.0,Gray,,,,,,
Lynel Guts,40px-BotW_Lynel_Guts_Icon.png?version=cfe4a87e8e843c6b9486c86e12e63a83 (https://v5.airtableusercontent.com/v3/u/41/41/1749067200000/fQKh24QCuhO6kM5ATXw2DA/ABARBkRO-fM6m3QES5x9qw_P2ySCq4X9-UFi84kv7OZkg213vZ3D1PN4Q48aKBODTax5OqaWCTTmnUXdNgm0PuOtLQOGGfhQtgCY_VQ_zjvpLHMzlDMIMJ5OXN11tIAdldG4vKQ_TGrVcRXsvSCJzj6fdQgSUkapYYvoDgJwmOE/JUFCT9at_n87KTXuQB2GvTiiKZOxS9JcKnU3ysHPwFQ),Material,Monster Part,,"This highly sought-after ingredient can only be obtained from a Lynel. It pulses with the vitality of a Lynel, a strength that makes it invaluable as an ingredient for elixirs.",,,,,3,,3:10,200,100.0,Crimson,,"Barbarian Armor,Barbarian Helm,Barbarian Leg Wraps,Fierce Deity Armor,Fierce Deity Boots,Fierce Deity Mask,Radiant Mask,Radiant Shirt,Radiant Tights,Soldier's Armor,Soldier's Greaves,Soldier's Helm",,,,
Shard of Dinraal's Fang,40px-BotW_Shard_of_Dinraal%27s_Fang_Icon.png?version=fb1aca86b7c20dc34dcd77a55d76403a (https://v5.airtableusercontent.com/v3/u/41/41/1749067200000/Nd57dGnOP7EUMbDG9lJc2Q/K0swlmHykVnYzv_xAFnElRM3Ho47SMWjSOBhwMcwvSmziB7q_wgwJrItFpZtaaF90ge_KvfXBufJX__77IuDQFl2LsVJHnXwxRamRIjVQ1VehYKYpix3svKJ-cwux91cUJhr2h7kYrtnxTLqZmEbjLEUVTVC9p08fonB40sbdVxC26rz6A0ZbIbjCXx1pKy-/2eSJ5GeDp54NUSsWC70aLQd270LZD9G7B9U1Ah0bhU8),Material,Monster Part,,"This shard fell from the red spirit Dinraal's fang. It's exceptionally hard and therefore impossible to process, but apparently it can be used as a material for something.",,,2.5,Bonus,3,,10:30,250,110.0,,,,,,,
Shard of Farosh's Fang,40px-BotW_Shard_of_Farosh%27s_Fang_Icon.png?version=9be7d76f069dec6548ee5045daf27a85 (https://v5.airtableusercontent.com/v3/u/41/41/1749067200000/dibnYHgRyiCSIqbl4Ec-oQ/vJ1RUc61vfpTDGV5h0e7e0CAlX5cQejSgpDNEpGBUdpXDKo7nmLZcXzS2LA-XZrpt77ZbBlDUt1wA1Y8Kckzil6lvMMiS0CiNzSnBcay3s7gWq6NOME6D9LT4qnmO6UK2piQBsjE2wTh3Bt3FCULf19BEq2NafMwLKyGmgykhc_nlGrJYWqHzKlUYodidBzV/mbghXmLKcZsPCvKzL6HGPu74SoNng99vJivjnBD1wj0),Material,Monster Part,,"This shard fell from the golden spirit Farosh's fang. It's so hard, hammers bounce right off it, so it's impossible to process. Yet rumors say it does have some use as a material.",,,2.5,Bonus,3,,10:30,250,110.0,,,"Cap of the Wild,Trousers of the Wild,Tunic of the Wild",,,,
Shard of Naydra's Fang,40px-BotW_Shard_of_Naydra%27s_Fang_Icon.png?version=fd9d31a561f71212ece71eacd2b135f4 (https://v5.airtableusercontent.com/v3/u/41/41/1749067200000/5wksxCtUEKZ2zxlMAz2VFg/5EL3ATFL5bNs_GGno9mLzRQCi2qg3H4Om6a9Ij0_kSSSJQoDb4FwqzR5NUrGlL15K7It29HjMqWQ6qA0g2r__vqLtntC6zUBZmCJKDj6TrxuvGtok6Di7s5lx6dZKWWVoqDjahmbDLCuv84C5wsCi18uh3AkNZmfT3HCXnJdt0-hNNZGUpCgziweI0JK6-tY/QDKZzOsnH9QLV_gP3wmrSDXD2HChoiVEiMrr7cSbosY),Material,Monster Part,,"This shard fell from the blue spirit Naydra's fang. It's much harder than any metal, so it's impossible to process. Yet rumors say it can be used as a material for something.",,,2.5,Bonus,3,,10:30,250,110.0,,,"Fierce Deity Armor,Fierce Deity Boots,Fierce Deity Mask",,,,
Shard of Dinraal's Horn,40px-BotW_Shard_of_Dinraal%27s_Horn_Icon.png?version=1790853ab178fbb0476969fa16c5075e (https://v5.airtableusercontent.com/v3/u/41/41/1749067200000/7YHDL3NwJUiNnKniYraJNA/bLvIq75GUH1-w9rmn9iOKedEmMHZ25wC-qG0NckbfuqOiVy0LYd0ASCdNizDtPwA5EiHNFGo75DfizdJtnGKAy0Z4c6xGYs-NoMKLgaehS94_5RhUM_MFKvJRLP7-uDxtfAGq_KFHdQVGmpSAoE793xkhztC_M0qUIfG3y1-IPCg1X3FE78EybDq78Uof2kf/2Qskxl9NI6SQZagMh5jjBTygPZEgeAtgG2f8wDpts8M),Material,Monster Part,,"This shard chipped and fell off the red spirit Dinraal. Its horn is said to be the crystallized power of fire itself. It sells for a high price, but rumors say there's some other use for it.",,,3.75,Bonus,4,,30:00,300,150.0,,,"Barbarian Armor,Barbarian Helm,Barbarian Leg Wraps,Champion's Tunic",,,,
Shard of Farosh's Horn,40px-BotW_Shard_of_Farosh%27s_Horn_Icon.png?version=6b50422955477dfa8e82ab9358205d0c (https://v5.airtableusercontent.com/v3/u/41/41/1749067200000/MjnDoKeK4woB8Dym3a5SCA/E0vQbps7aHIh-M2V97GoqGo8C7ikbhXRlbJUzpa-JM0ObbhqmMQCzdNNcyTKe3QUjWW_v0hLWY-n4YqhfOn1VrM2S1oM5a9GDVKIAmF1GsWgoXwpdEKDssDhZCYGvdo4m2WnG0jhSn9FTFEL904-iF76a8lgdf_5tLS3kRkbepdcKAYaroyXWdOZEPzQX0Yq/rUUi7ngp1ONdmTMAl98qYoBYnh9l1zF3UnaSr9JmMCE),Material,Monster Part,,"This shard fell off the golden spirit Farosh. It's said the horn is the crystallized power of electricity itself. It sells for a lot, but there must be some other use for it.",,,3.75,Bonus,4,,30:00,300,150.0,,,"Cap of the Wild,Champion's Tunic,Trousers of the Wild,Tunic of the Wild",,,,
Shard of Naydra's Horn,40px-BotW_Shard_of_Naydra%27s_Horn_Icon.png?version=0aacd9e5495c32a9f58de6718e7ff3de (https://v5.airtableusercontent.com/v3/u/41/41/1749067200000/ffbzGrtbvhyIq9LzSPyGeQ/YJMtMttbaaA-yNifohkVpfIXQHK6FgPW3lAqs_0wM3KuZLrJx5ZpBULUo_EAeDRvziqgs8a9q9qSqUEug-cKsOygGxCUzciIw4zGjVR10a7yOmDciMNqmsSX-eLs90_3brhJWh-iwIxILZBSA4X6oZWVG01W1hGomZMHERGLXKCbohvRdn7nNir2KlgRxU4m/cYjEQ38UF0cBv2-lMBadDPP6BLd7N2PCq6r6LWB_3NI),Material,Monster Part,,"This shard chipped and fell off the blue spirit Naydra. It's said the horn is the crystallized power of ice itself. It sells for quite a bit, but rumors say it has some other use.",,,3.75,Bonus,4,,30:00,300,150.0,,,"Champion's Tunic,Fierce Deity Armor,Fierce Deity Boots,Fierce Deity Mask",,,,
